{
  "$schema": "https://json-schema.org/draft/2020-12/schema",
  "type": "object",
  "additionalProperties": false,
  "required": ["schema", "source", "numeric_correspondence", "language", "standing", "recommendation"],
  "properties": {
    "schema": { "type": "string", "const": "canopus.claim-fidelity-assessment.v1" },
    "source": {
      "type": "object",
      "additionalProperties": false,
      "required": ["run_id", "roots", "artifact_root", "reported_claim"],
      "properties": {
        "run_id": { "type": "string", "const": "run_eb6bcd46-cffd-4ae8-b630-2681bd84da71" },
        "roots": {
          "type": "object",
          "additionalProperties": false,
          "required": ["actor_registry", "artifacts", "event_log", "proposals", "snapshot"],
          "properties": {
            "actor_registry": { "type": "string", "const": "sha256:665f3e1c48f0a50fac949681c0af01bdd28de2991f2cdc5cc4cddbe69df6311b" },
            "artifacts": { "type": "string", "const": "sha256:3d58619c5cfb7e28de2f344476e35c9f0b80709c996b2a1bfdb2e11496f7e1da" },
            "event_log": { "type": "string", "const": "sha256:a06797bc0d1b0e3c88a2f97507fe0832661e3992d8df41187a0aa6d3ceee9bde" },
            "proposals": { "type": "string", "const": "sha256:e69b38037814f2e8ca826942cfc50ab370993889be2913cac1c0b3e77711160f" },
            "snapshot": { "type": "string", "const": "sha256:1faedc24f040a60a22177b456c74b969a61ce8836082297b1835797a57b4fa56" }
          }
        },
        "artifact_root": { "type": "string", "const": "sha256:79370d5243095f28e65c218f3d5dc4710802e4dbe462fcfff1a35a8697a6f225" },
        "reported_claim": { "type": "string", "minLength": 1 }
      }
    },
    "numeric_correspondence": {
      "type": "object",
      "additionalProperties": false,
      "required": ["range_start", "range_end", "primes_tested", "max_multiplicity", "best_p", "best_residue"],
      "properties": {
        "range_start": { "$ref": "#/$defs/comparison" },
        "range_end": { "$ref": "#/$defs/comparison" },
        "primes_tested": { "$ref": "#/$defs/comparison" },
        "max_multiplicity": { "$ref": "#/$defs/comparison" },
        "best_p": { "$ref": "#/$defs/comparison" },
        "best_residue": { "$ref": "#/$defs/comparison" }
      }
    },
    "language": {
      "type": "object",
      "additionalProperties": false,
      "required": ["classification", "universal_claim_detected", "solved_language_detected", "flagged_phrases", "rationale"],
      "properties": {
        "classification": { "type": "string", "const": "model_assessment" },
        "universal_claim_detected": { "type": "boolean" },
        "solved_language_detected": { "type": "boolean" },
        "flagged_phrases": { "type": "array", "maxItems": 16, "items": { "type": "string" } },
        "rationale": { "type": "string", "minLength": 1, "maxLength": 1200 }
      }
    },
    "standing": {
      "type": "object",
      "additionalProperties": false,
      "required": ["verifier_success_reported", "policy_route", "accepted_state_delta", "scientific_acceptance_reported", "distinction"],
      "properties": {
        "verifier_success_reported": { "type": "boolean", "const": true },
        "policy_route": { "type": "string", "const": "defer" },
        "accepted_state_delta": { "type": "integer", "const": 0 },
        "scientific_acceptance_reported": { "type": "boolean", "const": false },
        "distinction": { "type": "string", "minLength": 1, "maxLength": 1200 }
      }
    },
    "recommendation": {
      "type": "object",
      "additionalProperties": false,
      "required": ["classification", "publishable_with_caveats", "revised_claim"],
      "properties": {
        "classification": { "type": "string", "const": "model_assessment" },
        "publishable_with_caveats": { "type": "boolean" },
        "revised_claim": { "type": "string", "minLength": 1, "maxLength": 1600 }
      }
    }
  },
  "$defs": {
    "comparison": {
      "type": "object",
      "additionalProperties": false,
      "required": ["reported", "artifact", "matches"],
      "properties": {
        "reported": { "type": "integer", "minimum": 0 },
        "artifact": { "type": "integer", "minimum": 0 },
        "matches": { "type": "boolean", "const": true }
      }
    }
  }
}
