{"language":{"classification":"model_assessment","flagged_phrases":[],"rationale":"The claim explicitly limits the exhaustive search and negative result to primes in the bounded range 10428401..10428600 and does not state or imply that the Erdős problem is solved.","solved_language_detected":false,"universal_claim_detected":false},"numeric_correspondence":{"best_p":{"artifact":10428581,"matches":true,"reported":10428581},"best_residue":{"artifact":5141590,"matches":true,"reported":5141590},"max_multiplicity":{"artifact":12,"matches":true,"reported":12},"primes_tested":{"artifact":15,"matches":true,"reported":15},"range_end":{"artifact":10428600,"matches":true,"reported":10428600},"range_start":{"artifact":10428401,"matches":true,"reported":10428401}},"recommendation":{"classification":"model_assessment","publishable_with_caveats":true,"revised_claim":"Exhaustive registered search over primes in 10428401..10428600 completed with a bounded negative result; the maximum factorial-residue fiber multiplicity found was 12 at p=10428581, residue=5141590. This bounded verifier-passed result does not solve the Erdős problem and has not been scientifically accepted."},"schema":"canopus.claim-fidelity-assessment.v1","source":{"artifact_root":"sha256:79370d5243095f28e65c218f3d5dc4710802e4dbe462fcfff1a35a8697a6f225","reported_claim":"Exhaustive registered search over primes in 10428401..10428600 completed with a bounded negative result; the maximum factorial-residue fiber multiplicity found was 12 at p=10428581, residue=5141590.","roots":{"actor_registry":"sha256:665f3e1c48f0a50fac949681c0af01bdd28de2991f2cdc5cc4cddbe69df6311b","artifacts":"sha256:3d58619c5cfb7e28de2f344476e35c9f0b80709c996b2a1bfdb2e11496f7e1da","event_log":"sha256:a06797bc0d1b0e3c88a2f97507fe0832661e3992d8df41187a0aa6d3ceee9bde","proposals":"sha256:e69b38037814f2e8ca826942cfc50ab370993889be2913cac1c0b3e77711160f","snapshot":"sha256:1faedc24f040a60a22177b456c74b969a61ce8836082297b1835797a57b4fa56"},"run_id":"run_eb6bcd46-cffd-4ae8-b630-2681bd84da71"},"standing":{"accepted_state_delta":0,"distinction":"The recorded verifier pass confirms verification of the registered bounded run; it does not constitute scientific acceptance, change accepted scientific state, or make this advisory itself scientific state.","policy_route":"defer","scientific_acceptance_reported":false,"verifier_success_reported":true}}
